{
  "schema_version": "1.0.0",
  "data_version": "1.0.0",
  "id": "22222222-2222-2222-2222-222222222222",
  "template_id": "monster_basic",
  "name": "Goblin",
  "entity_type": "monster",
  "position": {"x": 0.0, "y": 0.0, "z": 0.0},
  "rotation": 0.0,
  "scale": {"x": 1, "y": 1, "z": 1},
  "properties": {"health": 100, "damage": 12},
  "tags": ["enemy","melee"],
  "components": [{"type": "ai", "data": {"behavior": "aggressive"}}]
}